{
  "$schema": "https://json-schema.org/draft/2020-12/schema",
  "document_type": "BYON_EXECUTION_PLAN",
  "document_version": "1.0",
  "meta": {
    "project_name": "BYON Optimus - OpenClaw Integration",
    "version": "1.0.0",
    "created_at": "2026-02-01T00:00:00Z",
    "author": "Development Team",
    "objective": "Integrate BYON infinite memory orchestration system into OpenClaw platform while preserving both systems",
    "patent": "FHRSS/OmniVault - Vasile Lucian Borbeleac - EP25216372.0"
  },
  "architecture_overview": {
    "current_state": {
      "description": "OpenClaw operates as a messaging platform with extensions. FHRSS+FCPE exists in INFINIT_MEMORYCONTEXT and is partially integrated as the memory-fhrss-fcpe extension.",
      "components": {
        "openclaw_platform": {
          "location": "Byon_bot/openclaw-main/",
          "role": "Main platform - gateway, channels, UI, agents",
          "status": "FUNCTIONAL"
        },
        "fhrss_fcpe_python": {
          "location": "INFINIT_MEMORYCONTEXT/fhrss_fcpe_unified.py",
          "role": "Infinite memory system with FCPE compression and FHRSS recovery",
          "status": "FUNCTIONAL - tested at 50% loss recovery"
        },
        "memory_extension": {
          "location": "Byon_bot/openclaw-main/extensions/memory-fhrss-fcpe/",
          "role": "TypeScript wrapper for memory store/search",
          "status": "PARTIAL - requires full integration"
        }
      }
    },
    "target_state": {
      "description": "OpenClaw as PLATFORM + BYON as ORCHESTRATOR with infinite memory and MACP v1.1 protocol",
      "layers": [
        {
          "layer": 1,
          "name": "OpenClaw Platform Layer",
          "role": "SINGLE communication platform: all inbound/outbound messages go through OpenClaw only. BYON must not implement direct channel IO.",
          "preservation": "100% - core unchanged",
          "enforcement": "platform-gate.ts"
        },
        {
          "layer": 2,
          "name": "BYON Orchestration Layer",
          "role": "Decision making - receives input, consults memory, generates plans, controls flow",
          "new_components": [
            "byon-orchestrator",
            "evidence-builder",
            "plan-generator",
            "memory-context-manager"
          ]
        },
        {
          "layer": 3,
          "name": "Security & Validation Layer",
          "role": "Validation - Ed25519 signing, policy enforcement, user approval checkpoint",
          "new_components": [
            "auditor-service",
            "signature-manager",
            "policy-enforcer",
            "approval-ui"
          ]
        },
        {
          "layer": 4,
          "name": "Execution Layer",
          "role": "SINGLE execution engine: byon-executor (air-gapped). No other component executes code, edits files, or runs tests.",
          "new_components": [
            "byon-executor",
            "action-handlers",
            "receipt-generator"
          ],
          "enforcement": "execution-gate.ts"
        },
        {
          "layer": 5,
          "name": "Memory & Persistence Layer",
          "role": "Infinite memory - FHRSS+FCPE storage, audit trail, calendar indexing, global memory state",
          "components": [
            "fhrss-fcpe-service",
            "audit-trail",
            "calendar-index",
            "global-memory-vitalizer"
          ]
        },
        {
          "layer": 6,
          "name": "Kernel Enforcement Layer (Dual Gate)",
          "role": "WFP Semantic Guard - OS Kernel level enforcement of BYON intents. The 'Physical' gate.",
          "new_components": [
            "wfp-callout-driver",
            "wfp-controller",
            "semantic-bridge"
          ],
          "enforcement": "kernel-driver.sys"
        }
      ]
    }
  },
  "phases": [
    {
      "phase_id": "PHASE_1",
      "name": "Foundation Setup",
      "description": "Creating directory structure and basic configuration for BYON orchestrator",
      "duration_estimate": "2-3 days",
      "priority": "CRITICAL",
      "tasks": [
        {
          "task_id": "1.1",
          "name": "Create BYON directory structure",
          "description": "Create separate structure for BYON orchestrator in the project",
          "files_to_create": [
            "byon-orchestrator/package.json",
            "byon-orchestrator/tsconfig.json",
            "byon-orchestrator/src/index.ts",
            "byon-orchestrator/src/types/protocol.ts",
            "byon-orchestrator/src/types/memory.ts",
            "byon-orchestrator/src/types/audit.ts"
          ],
          "status": "done",
          "completed_at": "2026-02-01T15:00:00Z",
          "files_created_actual": [
            "byon-orchestrator/package.json",
            "byon-orchestrator/tsconfig.json",
            "byon-orchestrator/src/index.ts",
            "byon-orchestrator/src/types/protocol.ts",
            "byon-orchestrator/src/types/memory.ts",
            "byon-orchestrator/src/types/audit.ts",
            "byon-orchestrator/src/types/index.ts",
            "byon-orchestrator/src/protocol/evidence-pack.ts",
            "byon-orchestrator/src/agents/worker/evidence-builder.ts",
            "byon-orchestrator/src/agents/auditor/validator.ts"
          ]
        },
        {
          "task_id": "1.2",
          "name": "Configure BYON-OpenClaw integration points",
          "description": "Define integration points between BYON and OpenClaw",
          "files_to_create": [
            "byon-orchestrator/src/integration/openclaw-bridge.ts",
            "byon-orchestrator/src/integration/channel-adapter.ts",
            "byon-orchestrator/src/integration/memory-bridge.ts"
          ],
          "status": "done",
          "completed_at": "2026-02-01T18:45:00Z",
          "files_created_actual": [
            "byon-orchestrator/src/integration/openclaw-bridge.ts",
            "byon-orchestrator/src/integration/channel-adapter.ts",
            "byon-orchestrator/src/integration/memory-bridge.ts",
            "byon-orchestrator/src/integration/index.ts"
          ],
          "implementation_notes": "OpenClawBridge (SINGLE platform constraint), ChannelAdapter (normalize all channel types), MemoryBridge (FHRSS+FCPE primary, memory-core fallback)"
        },
        {
          "task_id": "1.3",
          "name": "Create unified configuration",
          "description": "Unified configuration for the entire BYON+OpenClaw system",
          "files_to_create": [
            "byon-config.ts"
          ],
          "config_schema": {
            "system": {
              "name": "string",
              "version": "string",
              "mode": "development | production"
            },
            "openclaw": {
              "enabled": "boolean",
              "gateway_port": "number",
              "channels": "object"
            },
            "byon": {
              "enabled": "boolean",
              "orchestrator_mode": "full | light",
              "memory_provider": "fhrss-fcpe | memory-core | lancedb",
              "auto_approve_risk_level": "low | medium | none"
            },
            "security": {
              "ed25519_enabled": "boolean",
              "keys_path": "string",
              "user_approval_required": "boolean"
            }
          },
          "status": "done",
          "completed_at": "2026-02-01T18:45:00Z",
          "files_created_actual": [
            "byon-config.ts"
          ],
          "implementation_notes": "Full ByonSystemConfig type with system, openclaw, byon, security, audit, executor sections. Environment variable overrides supported."
        }
      ]
    },
    {
      "phase_id": "PHASE_2",
      "name": "Memory System Integration",
      "description": "Full integration of the FHRSS+FCPE system with BYON orchestrator",
      "duration_estimate": "3-4 days",
      "priority": "CRITICAL",
      "depends_on": [
        "PHASE_1"
      ],
      "tasks": [
        {
          "task_id": "2.1",
          "name": "Create Python memory service",
          "description": "Python HTTP service for FHRSS+FCPE running as a microservice",
          "files_to_create": [
            "byon-orchestrator/memory-service/server.py",
            "byon-orchestrator/memory-service/handlers.py",
            "byon-orchestrator/memory-service/requirements.txt",
            "byon-orchestrator/memory-service/Dockerfile"
          ],
          "source_reference": "INFINIT_MEMORYCONTEXT/fhrss_fcpe_unified.py",
          "status": "done",
          "completed_at": "2026-02-01T19:30:00Z",
          "files_created_actual": [
            "byon-orchestrator/memory-service/server.py",
            "byon-orchestrator/memory-service/handlers.py",
            "byon-orchestrator/memory-service/requirements.txt",
            "byon-orchestrator/memory-service/Dockerfile"
          ],
          "implementation_notes": "FastAPI server wrapping FHRSS+FCPE. Supports store (code/conversation/fact), search, test_recovery, stats. SimpleEmbedder placeholder for production sentence-transformers."
        },
        {
          "task_id": "2.2",
          "name": "Enhance TypeScript memory client",
          "description": "Enhancement of TypeScript client with full support for AgentMemory API",
          "files_to_modify": [
            "byon-orchestrator/src/memory/client.ts"
          ],
          "features": [
            "storeCode(code, file, line, tags)",
            "storeConversation(content, role)",
            "storeFact(fact, source, tags)",
            "searchCode(query, topK)",
            "searchConversation(query, topK)",
            "searchFacts(query, topK)",
            "testRecovery(ctxId, lossPercent)",
            "getStats()"
          ],
          "status": "done",
          "completed_at": "2026-02-01T19:30:00Z",
          "files_created_actual": [
            "byon-orchestrator/src/memory/client.ts"
          ],